,id,descripcion,titulo,solucion,tipo_incidencia,descripcion_interna,etiqueta
35,165387,hola necesito que me llameis porque no deja coger el lote de un producto y no sabemos q hacerun saludo,no puedo coger un lote,pasamos el visualizador de transacciones de stock y se puede hacer el albarán de ese producto,consulta del cliente,hola necesito que me llameis porque no deja coger el lote de un producto y no sabemos q hacerun saludo01122023mlaura incidenciallama javierimg,gestión
36,165385,nos sale un error al cargar el programa pone lo siguientedbnetlib connectionopen connect0 no existe el servidor sql server o se ha denegado el acceso al mismo,no podemos entrar al programa,al reiniciar el servidor se solucionó el problema,consulta del cliente,horario de lv 900 1300 y 1600 1900nos sale un error al cargar el programa pone lo siguientedbnetlib connectionopen connect0 no existe el servidor sql server o se ha denegado el acceso al mismohablo con josepimg,sistemas
37,165369,necesitan que demos acceso a su servidor a sus informáticos sistemas acceso interactivo persona de contacto elias teléfono 93 5906366 extensión 2,acceso al servidor,hablo con carlos él no ha creado ninguna tarea ni sabe nada al respectoquedamos en cerrar tarea y esperar a que el que necesite algo llame o cree tarea de forma más concisa,consulta del cliente,necesitan que demos acceso a su servidor a sus informáticos sistemas acceso interactivo persona de contacto elias teléfono 93 5906366 extensión 2soluciónhablo con carlos él no ha creado ninguna tarea ni sabe nada al respecto quedamos en cerrar tarea y esperar a que el que necesite algo llame o cree tarea de forma más concisanota desde sistemas me confirman que nosotros no tenemos acceso a su servidor,sistemas
38,165355,estoy facturando el mes de noviembre y no encuentro las facturas que ya he hecho e impreso no aparecen en la relacion de facturas y tampoco los albaranes que son de esas facturasurgente,problemas con la facturacion,solucionado por el cliente,consulta del cliente,estoy facturando el mes de noviembre y no encuentro las facturas que ya he hecho e impreso no aparecen en la relacion de facturas y tampoco los albaranes que son de esas facturasurgente01122023mlaurasolucionado por el cliente,gestión
39,165339,como aplicar un coste de transporte al precio de un articulo desde el albarán de compra tenemos un vehículo que recoge mercancia de proveedores y queremos inputar a los artículos que trasiega un precio de transporte que quede reflejado en el coste del producto,imputar coste transporte,en la pestaña costes imputados podemos añadir más coste por línea de producto según tengamos internamente fasto o por medio de otro documento se indicará en el coste adicional de la línea de la co,consulta del cliente,horario de 900 1330 y 1600 1930 como aplicar un coste de transporte al precio de un articulo desde el albarán de compra tenemos un vehículo que recoge mercancia de proveedores y queremos inputar a los artículos que trasiega un precio de transporte que quede reflejado en el coste del productosoluciónen la pestaña costes imputados podemos añadir más coste por línea de producto según tengamos internamente fasto o por medio de otro documento se indicará en el coste adicional de la línea de la compra,gestión
40,165335,buenos dias soy inma de seragro integral estoy intentado sacar unos listados de articulos pero estoy intentado filtrar y tocar la configuracion y no me deja ni a mi ni a mis compañeroste paso el error,error,los usuarios de marcos juan e inma1 dar errores de access violation en la configuración de vista grid de artículos para poder corregirlo y tras varias pruebas cambiando perfiles y agregando otrosse crean nuevos usuarios y perfiles asignados a los mismos para la gestión de a3erp,consulta del cliente,horario de 800 a 1700buenos dias soy inma de seragro integral estoy intentado sacar unos listados de articulos pero estoy intentado filtrar y tocar la configuracion y no me deja ni a mi ni a mis compañeroste paso el errorproblemasoluciónlos usuarios de marcos juan e inma1 dar errores de access violation en la configuración de vista grid de artículos para poder corregirlo y tras varias pruebas cambiando perfiles y agregando otrosse crean nuevos usuarios y perfiles asignados a los mismos para la gestión de a3erp,gestión
41,165331,buenos díascuando puedan se ponen en contacto conmigotengo un problema en el pago de una factura a proveedores que me ha duplicado el programagraciassaludosles informamos que nuestra empresa permanecerá cerrada del 7 al 10 de diciembre por festividad nacional noelia abad,pago factura,se desliga el apunte contable que ha quedado reflejado en el mayor y no tiene cartera asignada para poder borrarlo y generar otra vez la factura y su correspondiente cartera y contabilidad,consulta del cliente,buenos díascuando puedan se ponen en contacto conmigotengo un problema en el pago de una factura a proveedores que me ha duplicado el programagraciassaludosles informamos que nuestra empresa permanecerá cerrada del 7 al 10 de diciembre por festividad nacional noelia abad01122023mlaurahe intentado llamar varias veces y se cancela la llamada despues de su correo he vuelto a intentarlo y sigue igualsoluciónse desliga el apunte contable que ha quedado reflejado en el mayor y no tiene cartera asignada para poder borrarlo y generar otra vez la factura y su correspondiente cartera y contabilidad,gestión
42,165326,una factura con una dirección que he modificado sigue saliendo igual,dirección modificada en factura,coge del campo dirección 2 la dirección del cliente para la factura de venta,consulta del cliente,una factura con una dirección que he modificado sigue saliendo igual01122023mlaura no esta en la oficina llamar el lunes solucióncoge del campo dirección 2 la dirección del cliente para la factura de venta,gestión
43,165324,buenos díashe renovado el certificado digital y hay que modificarlo en el programa no consigo hacerlo necesito enviar una factura de face hoypor favor contestarme lo antes posible,certificado digital nuevo,para poder instalar el certificado en el programa a3erp debe de estar el certificado instalado en el ordenador no sirve tenerlo en el servidorcomo he comentado una vez tengan el certificado en el ordenador en el que trabajan pueden llamarnos de nuevo y procederemos a instalarlo en a3erpsi tienen algo que indicar pueden mandar un correo a clientessdies,consulta del cliente,horario de 900 1300 buenos díashe renovado el certificado digital y hay que modificarlo en el programa no consigo hacerlo necesito enviar una factura de face hoypor favor contestarme lo antes posible01122023mlaura incidenciatiene instalado el nuevo certificado en el servidor y el programa no se lo reconoceimg,gestión
44,165322,,fichero que no saca del a3erp,corregimos la domiciliación del cliente y volvemos a generar el fichero de remesa,consulta cliente n2,problemaefecto de cliente que no se genera fichero remesa en el puesto incluso da errores de que no existe buscándolo en el puestoimg,cartera
45,165315,buenasnecesito que me expliquéis como se crean fichas de amortización tengo que crear varias elementos de transporte maquinariaetcmuchas gracias,crear ficha de amortización,se muestra al cliente desde al a3responde donde explica paso a paso cómo hacerlosi le surge alguna duda o comentario nos avisaráactivos fijos wolterskluweres,consulta del cliente,buenasnecesito que me expliquéis como se crean fichas de amortización tengo que crear varias elementos de transporte maquinariaetcmuchas graciassoluciónse muestra al cliente desde al a3responde donde explica paso a paso cómo hacerlosi le surge alguna duda o comentario nos avisaráactivos fijos wolterskluweres,gestión
46,165298,,13h actualizar a3erp,buenos díasse ha actualizado a3erp y siiadjunto links a las principales mejoras de las nuevas versiones de a3erp así como de siiversiones un saludo,mantenimiento preventivo,horario 5001300hactualizar el programa tienen la versión 140406el motivo es porque les ha salido el bug de fra borradora3erp 1404061 140408sii 310 330convesii 136canonsigfito 450 460,sistemas
47,165296,al entrar en a3 mensaje arrancando espere,error otro a3erp está arrancandoactualizando espere unos segundos,solucionar con sql el problema de arranque de a3erp,consulta del cliente,al entrar en a3 mensaje arrancando espereno pueden entrar en 3 equipos ni en el servidorpruebo en el servidorimg,sistemas
48,165295,explicar cambio de codigos,cambio de códigos,se aconseja en estos casos renombrar el artículo que tiene el número de registro antiguo crearcopiar con el mismo código un artículo e indicar el número de registro nuevo después realizar una regularización sacando las existencias con el número de registro antiguo y dando entrada con el número de registro nuevo marcar el artículo con el registro antiguo como obsoleto y bloqueado,consulta del cliente,explicar cambio de códigospregunta por yolanda porque ya ha llevado el tema y no quiere tener que explicarlo otra veznota 01122023 yolandahe llamado pero ya estaban se habían ido de la oficinalo que hay que explicar a fuensanta es lo que se ha explicado a su compañero se aconseja en estos casos renombrar el artículo que tiene el número de registro antiguo crearcopiar con el mismo código un artículo e indicar el número de registro nuevo después realizar una regularización sacando las existencias con el número de registro antiguo y dando entrada con el número de registro nuevo marcar el artículo con el registro antiguo como obsoleto y bloqueado04122023mlaura incidenciale explico a fuensanta lo que yolanda me ha dejado escritodice que no le podemos llamar a las 1400 horas porque es su descanso para comera parte ella quería hablar con yolanda pero como no esta ya entiende la solución que le propongo pues ya está me cuelga el teléfono sin más,gestión
49,165287,buenos días ayer estuvieron realizando actualizaciones en el programa y hoy no podemos acceder al programa en algún ordenadorpor favor necesitamos solucionarlo lo antes posibleun saludo,error al abrir programa,se realiza actualización pendiente del puesto de manuel para poder acceder a los módulos,consulta del cliente,buenos días ayer estuvieron realizando actualizaciones en el programa y hoy no podemos acceder al programa en algún ordenadorpor favor necesitamos solucionarlo lo antes posibleun saludosoluciónse realiza actualización pendiente del puesto de manuel para poder acceder a los módulos,sistemas
50,165282,buenos dias he sacado 3 pedidos a fabricar ahorapor favor fuerzalos para sacar las etiquetas ahoraque me corren prisa gracias,twister,lanzar sincro de twister para pasar los pedidos,consulta del cliente,buenos dias he sacado 3 pedidos a fabricar ahorapor favor fuerzalos para sacar las etiquetas ahoraque me corren prisa gracias,procesos externos
51,165281,todos los años tenemos problemas al subir el inventario pq nos descuadra las cantidades como es la forma optima de sacar el listado,inventario,desde la pestaña stock inventario en gestión de inventarios le damos nuevo y nos creamos un inventario a fecha de hoyexportamos a excel para usarlo para nuestro recuento y lo borramoscuando lo tengamos que hacer a día 01012024 hacemos nuevo y comprobamos que nos muestre todos nuestros artículos y modificamos unidades,consulta del cliente,todos los años tenemos problemas al subir el inventario pq nos descuadra las cantidades cómo es la forma optima de sacar el listadosolucióndesde la pestaña stock inventario en gestión de inventarios le damos nuevo y nos creamos un inventario a fecha de hoyexportamos a excel para usarlo para nuestro recuento y lo borramoscuando lo tengamos que hacer a día 01012024 hacemos nuevo y comprobamos que nos muestre todos nuestros artículos y modificamos unidades,gestión
52,165277,como poner en ficha de producto el precio del sigfitopara poder facturarlo junto al product,impuesto canon sigfito,para indicar que es un canon hay que poner el importe del canon en el artículoluego ver que este marcado aplicar impuestos especiales tanto en el cliente como en el proveedor,consulta del cliente,como poner en ficha de producto el precio del sigfitopara poder facturarlo junto al product01122023ya no esta en la oficina04122023es festivo en torres así que hasta mañana no estan05122023mlaura incidenciaquiere aplicar el canon sigfitosoluciónpara indicar que es un canon hay que poner el importe del canon en el artículoluego ver que este marcado aplicar impuestos especiales tanto en el cliente como en el proveedortuve que documentarme porque me pregunto si se podía hacer de forma masiva tiene vista antigua le he comentado que debería de ponerse la vista actual para irse actualizando para futuras versiones pero no esta dispuesto a ellole marco varios artículos con el importe del canonle marco varios clientes que contienen el canoncreo que volverá a llamar pues no le ha quedado muy claro después de realizar bastantes clientes y artículos,otro
53,165276,no puede entrar en a3erp le solicita usuario y contraseña,usuario y contraseña a3erp,se vuelven a añadir las credenciales del cloud,consulta del cliente,no puede entrar en a3erp le solicita usuario y contraseñasoluciónse vuelven a añadir las credenciales del cloudse añade en syspass la dirección del cloud,sistemas
54,165272,beunos dias estoy intentando facturar masivaente todos los albaranes del mes pasado y no me dejapodeis ayudarme,factura urgente,se configura serie borrador para omitir error de la facturación automática de albaranes de venta,consulta del cliente,beunos dias estoy intentando facturar masivaente todos los albaranes del mes pasado y no me dejapodeis ayudarmeproblemafacturación automática de albaranes de venta error por versión acerca de la serie de factura borradorsolución se configura serie borrador para omitir error de la facturación automática de albaranes de venta,gestión
55,165270,facturacion,urgente no hay ninguna serie configurada como factura borrador ir al mantenimiento de series y configurar una,bug de la versiónse propone varias opciones actualizar versión realizar la facturación manual crear una factura borrador sólo crear no trabajar con ella,bug fabricante,facturacion01122023mlaura incidenciatienen un problema parecido al del mes pasado están facturando pero a la hora de facturar lo hacen por ruta forma de pago ruta 8 mensual y les da el siguiente errorimg,otro
56,165269,no contabiliza bien los cuadres de caja,tpvcuadre de caja llamar al 674401049,solucionado por el cliente nos llamará cuando vuelva a suceder la incidencia del cuadre de caja y el efectivo,consulta del cliente,no contabiliza bien los cuadres de cajasoluciónel cliente indica que llamará otra vez si detecta el mismo problema nos volverá a llamar seguirá trabajando con el tpv hasta detectarlo,gestión
57,165256,consulta para ver cómo se puede cambiar el código de proveedor en varias facturas con efectos de cartera pagados,consulta,para poder cambiar el código del proveedor en las facturas de compra es necesario que el efecto de cartera de la factura esté en situación pendiente de pago si está pagado el efecto no se podrá realizar el cambio de código de proveedor en cualquier situación que se requiere un cambio o una modificación del documento su situación siempre tiene que ser pendiente para cualquier documento ya sea de venta o de compra tiene el mismo procedimientodebe deshacer el pago por anticipo en la factura para poder cambiar el código del proveedor tanto en el anticipo como en la factura de compra,consulta del cliente,horario 800 1300 y 1500 1600 consulta para ver cómo se puede cambiar el código de proveedor en varias facturas con efectos de cartera pagadossolución enviada por correopara poder cambiar el código del proveedor en las facturas de compra es necesario que el efecto de cartera de la factura esté en situación pendiente de pago si está pagado el efecto no se podrá realizar el cambio de código de proveedor en cualquier situación que se requiere un cambio o una modificación del documento su situación siempre tiene que ser pendiente para cualquier documento ya sea de venta o de compra tiene el mismo procedimientosolucióndebe deshacer el pago por anticipo en la factura para poder cambiar el código del proveedor tanto en el anticipo como en la factura de compra,cartera
58,165254,he creado un usuario y necesito copiar los permisos de otro usuario,crear usuario,copiamos los permisos de varios usuarios,consulta del cliente,he creado un usuario y necesito copiar los permisos de otro usuario01122023mlaura incidenciatiene varios usuarios creados quiere modificar uno y dar de alta a otro que tengan los tres las mismas característicassolucióncopiamos los permisos de varios usuarios,gestión
59,165242,este error nos ha dado al facturar,error al facturar a partir de las 930,ya solucionado por el cliente,consulta del cliente,este error nos ha dado al facturarsoluciónya solucionado por el cliente,gestión
60,165197,buenas tardes estoy presentado el intrastat de noviembre y me da este error he comprobado y yo lo veo correctome puede llamar alguien para verificar que pasa se ha producido un error en su declaracion 2311daa000023 a fecha 30112023 a continuacion le mostramos mas datos código error descripción error 2 0046 0586 ausencia del valor estadistico 2 0046 0581 ausencia valor factura 2 0048 0586 ausencia del valor estadistico 2 0048 0581 ausencia valor factura,error intrastat,solucionado por el cliente realizará manualmente la presentación del intrastat,consulta del cliente,buenas tardes estoy presentado el intrastat de noviembre y me da este error he comprobado y yo lo veo correctome puede llamar alguien para verificar que pasa se ha producido un error en su declaracion 2311daa000023 a fecha 30112023 a continuacion le mostramos mas datos código error descripción error 2 0046 0586 ausencia del valor estadistico 2 0046 0581 ausencia valor factura 2 0048 0586 ausencia del valor estadistico 2 0048 0581 ausencia valor factura,gestión
61,165190,no me deja hacer una agrupación de recibos para el 2024,agrupacion de recibos,en preferencias modificamos la fecha máxima a 31122024 y nos deja generar la agrupación sin problemasuna vez generada volvemos a poner la fecha que tenia el programa 31122023,consulta del cliente,horario de 800 1600no me deja hacer una agrupación de recibos para el 202430112023mlaura incidenciaquiere agrupar dos recibos pero para generar la agrupacion en enero 2024 y le sale errorsoluciónen preferencias modificamos la fecha máxima a 31122024 y nos deja generar la agrupación sin problemasuna vez generada volvemos a poner la fecha que tenia el programa 31122023,gestión
62,165188,buenos tardes no podemos acceder a a3 erp el aviso que nos muestra es que no tenemos licenciasun saludo,error al acceder al a3 erp gestor de licencias,se desactiva el licenciador,consulta del cliente,buenos tardes no podemos acceder a a3 erp el aviso que nos muestra es que no tenemos licenciasun saludo01122023preguntar por ricardo o por ceciliano les deja acceder al programa este es el errorimg,sistemas
63,165183,quiero dar de baja un inmovilizado que todavía no está totalmente amortizado se hacer los asientos manualmente pero no de forma automática con vuestro programa en la ficha no consigo cambiar la fecha de baja,baja inmovilizado,la baja de inmovilizado lo único que realiza es que en la ficha del inmovilizado aparece como cancelado no permite ya trabajar con ella y elimina las cuotas pendientes de amortizar y si es necesario recalcula la última cuotasi se quiere cambiar la fecha de la baja se puede dar al botón de anular baja y volver a dar la baja con la fecha deseada,consulta del cliente,horario de 900 1400 y 1600 1900 quiero dar de baja un inmovilizado que todavía no está totalmente amortizado se hacer los asientos manualmente pero no de forma automática con vuestro programa en la ficha no consigo cambiar la fecha de bajasoluciónla baja de inmovilizado lo único que realiza es que en la ficha del inmovilizado aparece como cancelado no permite ya trabajar con ella y elimina las cuotas pendientes de amortizar y si es necesario recalcula la última cuotasi se quiere cambiar la fecha de la baja se puede dar al botón de anular baja y volver a dar la baja con la fecha deseadaimg,gestión
64,165180,,error enlace a3eco,comentamos que la versión 1405 se podrá corregir la fecha contable de las facturas desde la facturación automáticapara el enlace dat se hace sin problemas pasan todas las facturas,consulta cliente n2,horario de 800 1500problemaen la exportación de a3eco no se genera archivo de una factura en concreto 2023 1955 se ha probado otras facturas y si generan la exportacióndejamos copia bbdd en el repositorio del clientetal cual aparece en la foto hay que sacar esa factura cuando procesas de generar error de no hay datosimg,gestión
65,165172,como realizar la baja de comisiones,consulta comisiones,no es obligatorio eliminar las comisiones una vez abonadas basta con hacer una selección de fecha a fecha y así el programa te calcula el importe de las comisiones a abonarsi aun así se quieren eliminar en el listado de comisiones tendremos que situarnos en la línea a eliminar y pulsar al signo,consulta del cliente,como realizar la baja de comisiones30112023mlaura incidenciaquiere pagar las comisiones desde el 2018 a un representante pero quiere luego eliminarlas del programasoluciónno es obligatorio eliminar las comisiones una vez abonadas basta con hacer una selección de fecha a fecha y así el programa te calcula el importe de las comisiones a abonarsi aun así se quieren eliminar en el listado de comisiones tendremos que situarnos en la línea a eliminar y pulsar al signo,gestión
66,165007,se me han desconfigurado algunas características hoy en la actualización hecha como las sumas de importes parciales,configuración menús,solucionado por el cliente,consulta del cliente,horario 800 1300 de 1500 1800 se me han desconfigurado algunas características hoy en la actualización hecha como las sumas de importes parciales30112023lo ha solucionado el clientecerrando el programa y volviendolo a abrir,gestión
67,165006,,problema de instalación de a3erp en un puesto,buenos díasse deja instalado a3erp en equipo que da erroresun saludo,consulta del cliente,horario lj 900 1400 y 1500 1800 v 900 1500img,sistemas
68,164953,en uno de los puesto no tienen acceso,no acceso a a3,se instala el programa correctamente,consulta del cliente,problemaen un equipo no puede entrar la programasoluciónpor sergio30112023en este equipo no se había hecho la carga del programa una vez actualizado y por eso no podía entrar se abre el programa con el usuario administrador hace la carga y entramos sin problema,gestión
69,164921,consultar clientes con saldo 000buenos díasruego se pongan en contacto conmigo para resolver esa duda gracias,consultar clientes con saldo 000,se envía excel de los datos migrados original para comparar con la información de su programa antiguo,consulta cliente n2,horario lj 900 1700 v 900 1500 consultar clientes con saldo 000ruego se pongan en contacto conmigo para resolver esa duda 30112023mlaura incidenciacliente de arpedice que no sabe los clientes que le deben dineroquiere un listado de los clientes que le deben dinero como tenia ese programano quiere el listado de carterano quiere entrar cliente por clienteporque tiene clientes que arrastran deuda del otro programaimg,cartera
70,164820,buenos diasel martes se conecto maria y me dejo los cubos de centro de coste correctoslo unico que en la columna precio de venta no me aparecen los precios de venta que tiene cada articulo asignado en su ficha me lo podeis poner para que apareazca por favor,cubos de centros de coste llamar 0512,añadimos el campo precio de venta de la ficha del artículo en el cubo de ventas,consulta cliente n2,buenos diasel martes se conecto maria y me dejo los cubos de centro de coste correctoslo unico que en la columna precio de venta no me aparecen los precios de venta que tiene cada articulo asignado en su ficha me lo podeis poner para que apareazca por favorproblemacubo configurado por sdi no saca el precio de venta del artículopor sergio05122023soluciónconectamos con el usuario y se añade en la vista del cubo para que aparezca el campo precio de venta de la ficha del artículose hace la prueba y aparece sin problema,gestión
71,164672,buenos díasvemos que estamos sacando lotes nuevos y se quedan viejos entiendo que el programa está preparado para sacar los lotes más antiguo y cuando se acaba el stock sacar el mas nuevo pero si se fija en la imagen los alterna y no sabemos el motivo,errores en los moviemientos de los lotes,se revisa el criterio de asignación de lotes en el proceso de servir pedidosse actualizará el 04122023 junto con las modificaciones realizadas en el ticket 162283,bug nivel 2 desarrollo,horario oficina 800 1300 y 1600 1930 buenos díasvemos que estamos sacando lotes nuevos y se quedan viejos entiendo que el programa está preparado para sacar los lotes más antiguo y cuando se acaba el stock sacar el mas nuevo pero si se fija en la imagen los alterna y no sabemos el motivoproblema con el proceso discon servir pedidos de venta que sirven el pedido de venta a una factura de venta no está cogiendo el lote correctamenteimg,procesos externos
